{
  "$schema": "https://json-schema.org/draft/2020-12/schema",
  "$id": "https://local.pi/setup.schema.json",
  "title": "Pi Greenfield Setup",
  "type": "object",
  "additionalProperties": false,
  "required": [
    "ui",
    "permissions",
    "lsp",
    "verificationStatus",
    "verification"
  ],
  "properties": {
    "$schema": { "type": "string" },
    "ui": {
      "type": "object",
      "additionalProperties": false,
      "required": ["theme", "motion"],
      "properties": {
        "theme": { "enum": ["aurora-night", "aurora-forge", "aurora-system"] },
        "motion": { "enum": ["expressive", "contextual", "reduced", "off"] },
        "dashboard": {
          "enum": ["auto", "compact", "expanded", "hidden"],
          "description": "Präsentation des Aurora-Dashboards; auto = dauerhaft sichtbar und responsiv (Default)."
        }
      }
    },
    "permissions": {
      "type": "object",
      "additionalProperties": false,
      "required": ["unknownTools", "bash"],
      "properties": {
        "unknownTools": { "enum": ["block", "ask", "allow"] },
        "bash": { "enum": ["block", "ask", "allow"] }
      }
    },
    "lsp": {
      "type": "object",
      "additionalProperties": false,
      "required": ["enabled", "mode", "requestTimeoutMs", "idleShutdownMs"],
      "properties": {
        "enabled": { "type": "boolean" },
        "mode": { "enum": ["off", "auto", "force"] },
        "requestTimeoutMs": {
          "type": "integer",
          "minimum": 1000,
          "maximum": 120000
        },
        "idleShutdownMs": {
          "type": "integer",
          "minimum": 10000,
          "maximum": 3600000
        }
      }
    },
    "verificationStatus": {
      "type": "object",
      "additionalProperties": false,
      "required": ["enabled"],
      "properties": {
        "enabled": { "type": "boolean" }
      }
    },
    "verification": {
      "type": "object",
      "additionalProperties": false,
      "required": ["typecheck", "test"],
      "properties": {
        "typecheck": { "$ref": "#/$defs/check" },
        "test": { "$ref": "#/$defs/check" }
      }
    }
  },
  "$defs": {
    "check": {
      "type": "object",
      "additionalProperties": false,
      "required": ["command", "args", "timeoutMs"],
      "properties": {
        "command": { "type": "string", "minLength": 1 },
        "args": {
          "type": "array",
          "items": { "type": "string" },
          "maxItems": 12
        },
        "timeoutMs": { "type": "integer", "minimum": 1000, "maximum": 900000 }
      }
    }
  }
}
